codigo;institucion_nombre;institucion_rut;tipo;descripcion;fecha_inicio;fecha_final;monto_estimado;unidad_monetaria;proveedores_participantes;adjudicados
1805-4-LE25;"";"60.908.000-0";"LE";"Contratar el Servicio de Prestaciones de apoyo en las especialidades de oftalmología,  otorrinolaringología y traumatología, a realizarse en las comunas urbanas yo rurales para los  beneficiarios del Programa de Servicios Médicos de la Junta Nacional de Auxilio Escolar y Becas, para  los años 2025-2026. Las prestaciones de apoyo corresponderán a los siguientes servicios: 1. Sesiones de plan de rehabilitación en baja visión 2. Adquisición, entrega y adecuación de lentes de contacto 3. Examen de audiometría 4. Examen de impendaciometría 5. Plan adaptación técnico para ayudas técnicas, área de otorrino 6. Plan adaptación pedagógico para ayudas técnicas, área de otorrino 7. Radiografías de columna Punta Arenas de tipo columna total: APLateral con y sin corsé, dorsal,  dorsolumbar, lumbar, lumbosacra 5° espacio, lumbosacra, de pelvis. 8. Sesiones de ejercicios kinésicos Punta Arenas 9. Sesiones de ejercicios kinésicos Natales";;;;"CLP";0;0
3824-8-LE25;"";"69.261.400-3";"LE";"El objetivo es adquirir 2205 poleras para alumnos de los cuatro establecimientos educacionales municipales, para uso en actividades institucionales internas y externas con la finalidad de profundizar y fortalecer el espíritu de pertenencia, con cargo a la Subvención Escolar Preferencial de cada establecimiento.";;;24500000;"CLP";0;0
3443-10-LE25;"";"69.210.500-1";"LE";"Contratación Profesional Ingeniero Civil en Obras Civiles para el Desarrollo de Estudios Estructurales.";;;13130000;"CLP";0;0
1747-12-L125;"";"61.606.205-0";"L1";"La presente licitación pública tiene como objetivo la adquisición e instalación de 2 equipos de aire acondicionado, con el fin de mejorar las condiciones de atención, tanto para funcionarios como pacientes del establecimiento de salud.";;;1200000;"CLP";0;0
3416-15-LE25;"";"61.101.017-6";"LE";"La Escuela Militar requiere el servicio de mantenimiento y reparación de bombas y sus elementos para su funcionamiento en el regadío de las áreas verdes de la Escuela Militar.";;;;"CLP";0;0
5124-4-LP25;"";"69.091.100-0";"LP";"Contratación de Servicio de Transporte Escolar desde y hacia los sectores rurales para Escuela C.R.S.H. y Liceo El Rosario. Año 2025";;;150000000;"CLP";0;0
2950-6-LE25;"";"61.102.010-4";"LE";"DESMALEZADO, PODA, TALA Y CORTE DE ÁRBOLES Y ARBUSTOS, SEGÚN ESPECIFICACIONES TECNICAS. SE REALIZARA VISITA A TERRENO OBLIGATORIA EL DIA 24 DE FEBRERO A LAS 10:00 HRS EN DEPENDENCIAS DE ESCUELA NAVAL, FRANCISCO GONZALEZ DE HONTANEDA 11 VALPARAISO.";;;;"CLP";0;0
2950-5-LE25;"";"61.102.010-4";"LE";"RECUPERAR RED DE AGUA POTABLE DEL COMPLEJO DEPORTIVO ESCUELA NAVAL ARTURO PRAT SE REALIZARA VISITA A TERRENO OBLIGATORIA EL DIA 25 DE FEBRERO A LAS 10:00 HRS EN DEPENDENCIAS DE ESCUELA NAVAL, FRANCISCO GONZALEZ DE HONTANEDA 11 VALPARAISO.";;;;"CLP";0;0
1064967-1-LE25;"";"60.506.000-5";"LE";"Se requiere mantener a la Escuela de Investigaciones Policiales con provisión oportuna y eficiente de materiales especializados para el rubro hidráulico, sanitario y de climatización a través de un proveedor que cuente con un stock amplio y especializado de dichos productos y que en caso de no contar con alguno de los materiales solicitados pueda buscarlos, conseguirlos y cotizarlos en forma eficiente, manteniendo el nivel de precios de mercado.";;;39600000;"CLP";0;0
1057500-13-LE25;"";"61.608.500-K";"LE";"el Servicio de Salud Metropolitano Sur Oriente requiere contratar la siguiente actividad de capacitación SERVICIO DE CAPACITACIÓN PARA INSTRUCTORES RCP AVANZADO, actividad requerida por parte del subdepartamento Red de Urgencia y Gestión de Camas, Subdirección Gestión Asistencial, Servicio de Salud Metropolitano Sur Oriente.";;;;"CLP";0;0
3928-4-LE25;"";"69.091.201-5";"LE";"CONTRATO DE SUMINISTRO SERVICIO DE MANTENCION Y REPARACION DE VEHICULOS DEL DEPARTAMENTO DE EDUCACION MUMICIPAL AÑO 2025";;;;"CLP";0;0
2410-2-L125;"";"69.170.102-6";"L1";"Se requiere disponer de un servicio de mantenimiento correctivo para Termodesinfectadora de Central de Esterilización para subsanar fallas en el funcionamiento de sus equipos.";;;3223948;"CLP";0;0
1029-8-LP25;"";"61.202.000-0";"LP";"La Dirección de Vialidad - Región del Maule, solicita ofertas para el Contrato por servicio de maestranza para la mantención, reparación y habilitación de sistemas para maquinarias.";;;;"CLP";0;0
1057489-77-LE25;"";"61.608.406-2";"LE";"Que, el Hospital del Salvador necesita contar con un Convenio de Suministro de Kits de Derrame Citostático por veinticuatro (24) meses, para dependencias del Hospital del Salvador con la finalidad de satisfacer de manera adecuada y eficiente la labor asistencial;   Que, por la cuantía determinada, la presente licitación se ubica en el tramo para aquellas contrataciones iguales o superiores a 100 UTM e inferiores a 1.000 UTM, en conformidad al Artículo 36º del Reglamento de la Ley Nº19.886;  Que, hechas las consultas respectivas, la provisión de Convenio de Suministro de Kits de Derrame Citostático por veinticuatro (24) meses, para dependencias del Hospital del Salvador no se encuentra disponible por Convenio Marco ofrecidos en el Sistema de Información de la Dirección de Compras, www.mercadopublico.cl;";;;54000000;"CLP";0;0
621-171-LR25;"";"61.608.700-2";"LR";"BASES ADMINISTRATIVAS Y TÉCNICAS TIPO, POR LAS QUE SE REGIRÁN LOS PROCESOS DE LICITACIÓN PARA LA ADQUISICIÓN DE PRODUCTOS FARMACÉUTICOS, COSMÉTICOS, VACUNAS, INSUMOS, DISPOSITIVOS, Y/O ALIMENTOS DE USO MÉDICO, DESTINADO AL EJERCICIO DE ACCIONES DE SALUD";;;1685606630;"CLP";0;0
2599-2-LE25;"";"73.568.600-3";"LE";"CONTRATACIÓN SERVICIOS MÉDICOS ESPECIALIDAD NEUROLOGÍA O PSIQUIATRIA INFANTIL, PROCESO EVALUACIÓN DIAGNÓSTICA DE LAS ALUMNAOS, SEGÚN DETALLE EN DECRETO ALCALDICIO N°583 QUE CONTIENE LAS BASES TÉCNICAS Y ADMINISTRATIVAS PARA LA LICITACIÓN.";;;12430000;"CLP";0;0
1655-7-LP25;"";"61.608.605-7";"LP";"“SERVICIO DE ADMINISTRADORA DE SALAS CUNAS PARA DAP SSMC";;;;"CLP";0;0
1202333-21-LP25;"";"69.060.700-K";"LP";"Servicio de transporte de estudiantes desde Valle Alegre y sectores Rurales hacia Quintero y servicios de Quintero hacia diversos colegios de la Comuna 2025.";;;;"CLP";0;0
1338460-2-LE25;"";"61.607.006-1";"LE";"Que, el Hospital Comunitario de Salud Familiar El Carmen, requiere contratar servicios de profesional odontólogo para ejecutar Programa GES Odontológico a Adultos GES 60 años con rehabilitación protésica, según necesidad en usuarios inscritos en el Hospital Comunitario de Salud Familiar El Carmen";;;;"CLP";0;0
2275-3-LP25;"";"69.253.800-5";"LP";"Servicio de Mantenimiento de vehículos y maquinaria para la Dirección de Gestión Ambiental (DIGA), de carácter preventivo, correctivo y de reparación de vehículos motorizados, según descripción de la flota vehicular municipal que se señala en las especificaciones técnicas.";;;;"CLP";0;0
906973-3-LE25;"";"69.100.700-6";"LE";"SERVICIO DE INTERNET PARA LA MUNICIPALIDAD DE VICHUQUÉN";;;;"CLP";0;0
1057547-83-LQ25;"";"61.607.502-0";"LQ";"CONVENIO COMPRA DE SERVICIO PARA REALIZACION DE RESONANCIAS MAGNETICAS EN EL HOSPITAL BASE VALDIVIA";;;326000000;"CLP";0;0
1075337-9-LE25;"";"61.602.222-9";"LE";"El objetivo de la presente licitación es la contratación del servicio de mantenimiento y suministro de repuestos e instalaciones de aire, vacío y redes para gases clínicos del Hospital Dr. Mauricio Heyermann Torres de Angol.";;;65000000;"CLP";0;0
621-170-LR25;"";"61.608.700-2";"LR";"BASES ADMINISTRATIVAS Y TÉCNICAS TIPO, POR LAS QUE SE REGIRÁN LOS PROCESOS DE LICITACIÓN PARA LA ADQUISICIÓN DE PRODUCTOS FARMACÉUTICOS, COSMÉTICOS, VACUNAS, INSUMOS, DISPOSITIVOS, Y/O ALIMENTOS DE USO MÉDICO, DESTINADO AL EJERCICIO DE ACCIONES DE SALUD";;;531022030;"CLP";0;0
3843-3-LE25;"";"69.100.400-7";"LE";"EL DEPARTAMENTO DE EDUCACION REQUIERE ADQUIRIR DE TEXTOS DE LECTURA COMPLEMENTARIA ESCUELA RAUCO, SEGÚN ESPECIFICACIONES TECNICAS ADJUNTAS.-";;;;"CLP";0;0
377-6-LE25;"";"69.061.600-9";"LE";"USO:  MANENCION Y REPARACION DE ALUMBRADO PÚBLICO";;;;"CLP";0;0
1563-2-LE25;"";"61.603.000-0";"LE";"El Fondo Nacional de Salud requiere contratar los servicios para la ejecución de las obras referidas a Remodelación Espacios Interno Oficinas Administrativas Dirección Zonal Centro Sur, ubicada en Avenida Diagonal Pedro Aguirre Cerda N° 1129, 4° Piso, comuna de Concepción, Región del Bio-Bio. Las obras contemplan:  a	Hall de entrada la confección de nueva oficina y otros b	En Pasillo Central retiro de Paredes de oficina colindantes a pasillo central las que serán reemplazadas por perfilería vidriada c	Desplazamiento de Pared oficina de Asesores y otros";;;15000000;"CLP";0;0
3032-5-LE25;"";"69.081.600-8";"LE";"SUMINISTRO DE MATERIALES DE FERRETERÍA PARA DEPARTAMENTO DE EDUCACIÓN, PERIODO 2025";;;;"CLP";0;0
2403-28-LE25;"";"69.254.000-k";"LE";"La presente licitación tiene por objeto la adquisición de i 10 monitores led; ii 3 mandos de control PTZ; iii 10 Soporte pared para monitor, y iv 8 Discos duros 8TB, para el centro de control y sala de monitoreo de televigilancia existente en la 43° Comisaría de Peñalolén, ubicada en Avenida Consistorial N° 2060.";;;26877078;"CLP";0;0
2145-1-LE25;"";"61.606.409-6";"LE";"COMPRA DE SERVICIOS PARA TOMA E INFORME DE IMÁGENES DIAGNOSTICAS EL HOSPITAL SAN PEDRO DE LOS VILOS";;;;"CLP";0;0
1605-23-CO25;"";"60.803.000-K";"CO";"El SII requiere contratar los servicios de “Actividades de fortalecimiento de la educación fiscal y tributaria en escolares, docentes y apoderados”. En particular, se requiere la planificación, diseño y producción de actividades que potencien la educación fiscal y tributaria en escolares.";;;20000000;"CLP";0;0
1028871-15-B225;"";"61.999.330-6";"B2";"El Servicio Local de Educación Pública de Huasco en adelante SLEPH, invita a participar en la presente propuesta privada “de LICITACION PRIVADA,“ E1O2RT9 TRANSPORTE ESCOLAR SLEPH 2025, HUASCO”, con el fin de satisfacer la demanda de transporte escolar de cada Establecimiento Educacional E.E.  de la Provincia del Huasco, según los tramos y recorridos que se detallaran más adelante, en las presentes bases y sus anexos, con una duración máxima hasta el 31 de diciembre del 2025 o hasta agotar el presupuesto asignado para esta licitación.";;;;"CLP";0;0
3928-3-LE25;"";"69.091.201-5";"LE";"CONTRATO DE SUMINISTRO LUBRICANTES Y ACCESORIOS PARA VEHICULOS DEL DEPARTAMENTO DE EDUCACION MUNICIPAL AÑO 2025";;;;"CLP";0;0
3756-6-LP25;"";"69.110.600-4";"LP";"MANTENCIÓN Y REPARACIÓN DEL PARQUE VEHICULAR, PELARCO.";;;120000000;"CLP";0;0
621-169-LE25;"";"61.608.700-2";"LE";"BASES ADMINISTRATIVAS Y TÉCNICAS TIPO, POR LAS QUE SE REGIRÁN LOS PROCESOS DE LICITACIÓN PARA LA ADQUISICIÓN DE PRODUCTOS FARMACÉUTICOS, COSMÉTICOS, VACUNAS, INSUMOS, DISPOSITIVOS, Y/O ALIMENTOS DE USO MÉDICO, DESTINADO AL EJERCICIO DE ACCIONES DE SALUD";;;23332925;"CLP";0;0
732465-1-LE25;"";"60.301.001-9";"LE";"ADQUISICIÓN Y DISTRIBUCIÓN DE BIDONES DE AGUA PURIFICADA Y ENTREGA DE DISPENSADORES EN COMODATO AL 6° TRIBUNAL DE JUICIO ORAL EN LO PENAL DE SANTIAGO";;;;"CLP";0;0
5615-13-LQ25;"";"69.141.700-K";"LQ";"“CONSTRUCCIÓN CAMARINES SECTOR SAN FRANCISCO, COMUNA EL CARMEN”, DE ACUERDO A ESPECIFICACIONES TECNICAS PLANIMETRIA MEMORIAS Y DEMAS ANTECEDENTES QUE FORMAN PARTE DEL PRESENTE PROCESO DE LICITACION";;;;"CLP";0;0
3471-2-LP25;"";"60.505.723-3";"LP";"La necesidad de contar con la Contratación de Suministro de Propofol y Remifentanilo, con equipamiento en comodato, para el Hospital de Carabineros, por un periodo de 24 meses o hasta la total ejecución del presupuesto contratado, pertenecientes al Arsenal de medicamentos Año 2024, con el objeto de contar con los artículos necesarios para dispensar las atenciones médicas en forma oportuna, asegurando un abastecimiento permanente y precios estables. REX N°297 DE FECHA 18.02.2025, SOLICITUD 2484247, CDP N°H170.";;;;"CLP";0;0
621-168-LR25;"";"61.608.700-2";"LR";"BASES ADMINISTRATIVAS Y TÉCNICAS TIPO, POR LAS QUE SE REGIRÁN LOS PROCESOS DE LICITACIÓN PARA LA ADQUISICIÓN DE PRODUCTOS FARMACÉUTICOS, COSMÉTICOS, VACUNAS, INSUMOS, DISPOSITIVOS, Y/O ALIMENTOS DE USO MÉDICO, DESTINADO AL EJERCICIO DE ACCIONES DE SALUD";;;935240239;"CLP";0;0
5350-1-LE25;"";"69.030.500-3";"LE";"Se requeriré container, para Sala modular, totalmente equipada de acuerdo a características técnicas, debe ser instalado en Dependencias del Cesfam Estación, en el frontis donde actualmente se ubicación de juego estructura de madera, y bancas, motivó por el cual también se solicita retiro y reubicación de estas estructuras.-";;;17820000;"CLP";0;0
621-167-LE25;"";"61.608.700-2";"LE";"BASES ADMINISTRATIVAS Y TÉCNICAS TIPO, POR LAS QUE SE REGIRÁN LOS PROCESOS DE LICITACIÓN PARA LA ADQUISICIÓN DE PRODUCTOS FARMACÉUTICOS, COSMÉTICOS, VACUNAS, INSUMOS, DISPOSITIVOS, Y/O ALIMENTOS DE USO MÉDICO, DESTINADO AL EJERCICIO DE ACCIONES DE SALUD";;;47708928;"CLP";0;0
1070620-37-LP25;"";"62.000.530-4";"LP";"rfm Servicio de Mantenimiento Preventivo y Correctivo de Equipos de Climatización CHILLER, UMAS y VEX para el HETG Rex. 349 de 18FEB2025";;;;"CLP";0;0
3928-2-LE25;"";"69.091.201-5";"LE";"CONTRATO DE SUMINISTRO MATERIALES DE CONSTRUCCIÓN PARA EL DEPARTAMENTO DE EDUCACION MUNICIPAL, ESTABLECIMIENTOS EDUCACIONALES, JARDINES INFANTILES AÑO 2025";;;;"CLP";0;0
2184-3-LR25;"";"60.301.001-9";"LR";"Servicio de Traslado de Personas para el Centro Integrado de Notificaciones Judiciales de Santiago.";;;;"CLP";0;0
5240-20-LE25;"";"61.938.500-4";"LE";"MATERILIZAR LA CONTRATACIÓN DEL SERVICIO DE PRODUCCIÓN 4a CAMINATA FAMILIAR CANINA 98 ANIVERSARIO DE CARABINEROS DE CHILE";;;44000000;"CLP";0;0
621-166-LE25;"";"61.608.700-2";"LE";"BASES ADMINISTRATIVAS Y TÉCNICAS TIPO, POR LAS QUE SE REGIRÁN LOS PROCESOS DE LICITACIÓN PARA LA ADQUISICIÓN DE PRODUCTOS FARMACÉUTICOS, COSMÉTICOS, VACUNAS, INSUMOS, DISPOSITIVOS, Y/O ALIMENTOS DE USO MÉDICO, DESTINADO AL EJERCICIO DE ACCIONES DE SALUD";;;45636024;"CLP";0;0
4856-5-LE25;"";"69.160.700-3";"LE";"Contrato suministro de Retiro de Residuos, Dpto de Salud Tirúa, según bases adjuntas.";;;;"CLP";0;0
621-165-LQ25;"";"61.608.700-2";"LQ";"BASES ADMINISTRATIVAS Y TÉCNICAS TIPO, POR LAS QUE SE REGIRÁN LOS PROCESOS DE LICITACIÓN PARA LA ADQUISICIÓN DE PRODUCTOS FARMACÉUTICOS, COSMÉTICOS, VACUNAS, INSUMOS, DISPOSITIVOS, Y/O ALIMENTOS DE USO MÉDICO, DESTINADO AL EJERCICIO DE ACCIONES DE SALUD";;;144103050;"CLP";0;0
963799-7-LE25;"";"61.606.912-8";"LE";"ABASTECER DE INSUMOS VARIOS A LA UNIDAD DE LABORATORIO DEL HOSPITAL DE SAN JAVIER PARA ASÍ PODER REALIZAR EXÁMENES A LOS USUARIOS.";;;;"CLP";0;0
2098-20-LP25;"";"61.602.211-3";"LP";"Conforme a Ley de Compras Públicas Nº19.886, el reglamento, sus modificaciones y su modernización, el Hospital Dr. Rafael Avaria Valenzuela de Curanilahue a través del Departamento de Abastecimiento y Logística, invita a los oferentes, personas naturales o jurídicas y Uniones Temporales de Proveedores, a participar en la licitación pública para contar con una Empresa externa, que provea de bienes o servicios, para el Hospital de Curanilahue y la red del Servicio de Salud, determinado los requisitos administrativos mínimos para participar en la propuesta y garantizar con este mismo instrumento la calidad y entrega del servicio requerido. Las Bases Administrativas, Anexos y todas las contempladas en el ID 2098-20-LP25, establecen las condiciones que regirán la Licitación y el posterior convenio que se celebre para dar cumplimiento a este objeto.";;;84892500;"CLP";0;0
3928-1-LE25;"";"69.091.201-5";"LE";"CONTRATO DE SUMINISTRO ARIDOS PARA EL DEPARTAMENTO DE DE EDUCACION MMUNICIPAL, ESTABLECIMIENTOS EDUCACIONALES, JARDINES INFANTILES, AÑO 2025";;;;"CLP";0;0
2098-19-LP25;"";"61.602.211-3";"LP";"Conforme a Ley de Compras Públicas Nº19.886, el reglamento, sus modificaciones y su modernización, el Hospital Dr. Rafael Avaria Valenzuela de Curanilahue a través del Departamento de Abastecimiento y Logística, invita a los oferentes, personas naturales o jurídicas y Uniones Temporales de Proveedores, a participar en la licitación pública para contar con una Empresa externa, que provea de bienes o servicios, para el Hospital de Curanilahue y la red del Servicio de Salud, determinado los requisitos administrativos mínimos para participar en la propuesta y garantizar con este mismo instrumento la calidad y entrega del servicio requerido. Las Bases Administrativas, Anexos y todas las contempladas en el ID 2098-19-LP25, establecen las condiciones que regirán la Licitación y el posterior convenio que se celebre para dar cumplimiento a este objeto.";;;92767500;"CLP";0;0
1024-2-LP25;"";"61.202.000-0";"LP";"Que, se requiere contar con Servicio de Vigilancia para las oficinas y dependencias de la oficina Provincial Iquique, Oficina Provincia del Tamarugal y Laboratorio Regional de la Dirección de Vialidad, Región de Tarapacá.";;;;"CLP";0;0
229-21-LE25;"";"69.141.100-1";"LE";"SERVICIO DE REPARACIÓN DEL AIRE ACONDICIONADO DE LOS VEHICULOS DE LA FLOTA MUNICIPAL, SEGÚN BASES TÉCNICAS Y DEMÁS ANTECEDENTES.";;;;"CLP";0;0
3436-10-LE25;"";"61.101.027-3";"LE";"Contratar el servicio para campaña publicitaria admisión 2026";;;21562000;"CLP";0;0
1655-8-LP25;"";"61.608.605-7";"LP";"La Dirección de Atención Primaria del Servicio de Salud Metropolitano Central, requiere del “SERVICIO DE RETIRO, TRATAMIENTO, DISPOSICIÓN Y/O VALORACIÓN DE RESIDUOS DAP-SSMC”";;;255000000;"CLP";0;0
1655-76-LE24;"";"61.608.605-7";"LE";"La Dirección de Atención Primaria requiere de Dar continuidad a un Servicio con un sistema de Imagenología digital RIS-PACS que permita la conexión, integración e interoperabilidad con la Red de imágenes que posee SAR Pincheira, y sus establecimientos la Dirección de Atención Primaria del Servicio de Salud Metropolitano Central.";;;;"CLP";0;0
2098-21-LQ25;"";"61.602.211-3";"LQ";"Conforme a Ley de Compras Públicas Nº19.886, el reglamento, sus modificaciones y su modernización, el Hospital Dr. Rafael Avaria Valenzuela de Curanilahue a través del Departamento de Abastecimiento y Logística, invita a los oferentes, personas naturales o jurídicas y Uniones Temporales de Proveedores, a participar en la licitación pública para contar con una Empresa externa, que provea de bienes o servicios, para el Hospital de Curanilahue y la red del Servicio de Salud, determinado los requisitos administrativos mínimos para participar en la propuesta y garantizar con este mismo instrumento la calidad y entrega del servicio requerido. Las Bases Administrativas, Anexos y todas las contempladas en el ID 2098-21-LQ25, establecen las condiciones que regirán la Licitación y el posterior convenio que se celebre para dar cumplimiento a este objeto.";;;190102500;"CLP";0;0
2098-16-LQ25;"";"61.602.211-3";"LQ";"Conforme a Ley de Compras Públicas Nº19.886, el reglamento, sus modificaciones y su modernización, el Hospital Dr. Rafael Avaria Valenzuela de Curanilahue a través del Departamento de Abastecimiento y Logística, invita a los oferentes, personas naturales o jurídicas y Uniones Temporales de Proveedores, a participar en la licitación pública para contar con una Empresa externa, que provea de bienes o servicios, para el Hospital de Curanilahue y la red del Servicio de Salud, determinado los requisitos administrativos mínimos para participar en la propuesta y garantizar con este mismo instrumento la calidad y entrega del servicio requerido. Las Bases Administrativas, Anexos y todas las contempladas en el ID 2098-16-LQ25, establecen las condiciones que regirán la Licitación y el posterior convenio que se celebre para dar cumplimiento a este objeto.";;;237006000;"CLP";0;0
948354-15-LE25;"";"61.513.003-6";"LE";"El Hospital de la Dirección de Previsión de Carabineros de Chile, ubicado en Vital Apoquindo N°1.200, Comuna de Las Condes, Región Metropolitana, en adelante “EL HOSPITAL”, llama a Licitación Pública para la Contratación del Servicio de Reparación e Instalación de Controladores de Aire, en adelante “EL SERVICIO”, cuyas características y requisitos técnicos constan en las siguientes Bases.";;;;"CLP";0;0
2098-14-LQ25;"";"61.602.211-3";"LQ";"Conforme a Ley de Compras Públicas Nº19.886, el reglamento, sus modificaciones y su modernización, el Hospital Dr. Rafael Avaria Valenzuela de Curanilahue a través del Departamento de Abastecimiento y Logística, invita a los oferentes, personas naturales o jurídicas y Uniones Temporales de Proveedores, a participar en la licitación pública para contar con una Empresa externa, que provea de bienes o servicios, para el Hospital de Curanilahue y la red del Servicio de Salud, determinado los requisitos administrativos mínimos para participar en la propuesta y garantizar con este mismo instrumento la calidad y entrega del servicio requerido. Las Bases Administrativas, Anexos y todas las contempladas en el ID 2098-14-LQ25, establecen las condiciones que regirán la Licitación y el posterior convenio que se celebre para dar cumplimiento a este objeto.";;;197505000;"CLP";0;0
2963-11-LQ25;"";"69.072.400-6";"LQ";"Las presentes Bases están relacionadas a licitación para el “MEJORAMIENTO MULTICANCHA PADRE HURTADO II, COMUNA LA GRANJA” código 1-C-2023-1832";;;;"CLP";0;0
2440-56-LE25;"";"69.100.100-8";"LE";"El Departamento de Administración de Educación Municipal de Curicó requiere adquirir Instalación de Invernadero para el Establecimiento Educacional Anexo Politécnico Curicó";;;10700000;"CLP";0;0
2963-10-LQ25;"";"69.072.400-6";"LQ";"LAS PRESENTES BASES ESTAN REFERIDAS A LICITACION PARA EL “MEJORAMIENTO MULTICANCHAS COMBARBALA COMUNA DE LA GRANJA”  CÓDIGO 40062807-0";;;;"CLP";0;0
886954-90-LP25;"";"61.602.189-3";"LP";"La necesidad de abastecer del insumo para la atención oportuna del paciente.";;;310000000;"CLP";0;0
1171142-13-LE25;"";"62.000.830-3";"LE";"La Dirección del Complejo Asistencial Padre Las Casas, requiere la “ADQUISICIÓN DE ELECTRODO CORTE BIPOLAR 2426 FR 30  PARA EL COMPLEJO ASISTENCIAL PADRE LAS CASAS”.  Con la finalidad de dar una atención a los usuarios del sistema público de salud de la provincia de Cautín, se requiere adquirir suministro de insumos para las unidades clínicas. La modalidad de adquisición será periódicamente con entrega parcializada, o según requerimientos en un lapso de 24 meses, con posibilidad de renovación por un plazo máximo de 12 meses más. Teniendo por objetivo asegurar la oportunidad del abastecimiento y entrega de los insumos, requeridos por el establecimiento.  Con el objeto de procurar satisfacer la necesidad antes indicada, por las razones antes mencionadas se ha estimado conveniente convocar a la presente licitación para adquirir dichos bienes y servicios, según corresponda; por lo que, se invita a participar a quienes estén en condiciones de satisfacer la demanda, en la forma y condiciones que luego se indica.";;;47124000;"CLP";0;0
3443-9-LE25;"";"69.210.500-1";"LE";"Contratación Profesional Constructor Civil Para el Apoyo y Desarrollo Técnico de Los Proyectos.-";;;16116000;"CLP";0;0
610-1-LQ25;"";"61.707.000-6";"LQ";"Realizar un análisis de la información de los bienes de las empresas concesionarias destinadas a la distribución del servicio público de gas utilizados en cada una de sus zonas de concesión, estableciendo fundada y sistemáticamente todas las recomendaciones que permitan a esta Comisión considerar solo aquellos bienes y su respectiva valorización que resulten pertinentes para determinar el VNR a utilizarse en los chequeos de rentabilidad correspondientes a los años 2026 al 2029. Asimismo, proponer y calcular indicadores de eficiencia por zona de concesión para evaluar nuevas instalaciones o bienes que se pongan en operación por parte de las empresas concesionarias a utilizar en los chequeos anuales de rentabilidad del cuatrienio 2026-2029. Además, se deberá actualizar y cuando corresponda determinar, los modelos y/o metodologías de valorización de gastos de comercialización, los cuales corresponden a los gastos que realizan las empresas concesionarias al interior de la propiedad de sus clientes, es decir, desde la salida del medidor hasta los artefactos   (PMG estado Verde E1O2RT9)";;;260000000;"CLP";0;0
2175-2-LR25;"";"60.301.001-9";"LR";"Servicio de Aseo e Insumos para la Jurisdicción de Copiapó";;;;"CLF";0;0
1499-52-LQ25;"";"61.608.402-k";"LQ";"El Instituto Nacional del Tórax requiere realizar la contratación del servicio de suministro de Gases clínicos y cilindros por el período de 36 meses para dar un servicio de consumo de gases medicinales con la efectividad, seguridad y condiciones de calidad que cada paciente requiere.";;;148343800;"CLP";0;0
1151575-1-LE25;"";"65.195.573-4";"LE";"“Adquisición de bancos de formación neumática y electrohidráulica para las clases teóricas y prácticas de su carrera “Mantenimiento Electromecánico de Equipos Móviles” MEEM del Centro de Formación Técnica de la Región de Atacama”, de acuerdo a las  Bases Administrativas, Técnicas y Anexos de la presente licitación.";;;19000000;"CLP";0;0
2670-1-LR25;"";"69.150.400-K";"LR";"Concesionar 1447 espacios de estacionamiento en las vias publicas de la comuna de Concepcion";;;;"CLF";0;0
4375-32-LE25;"";"61.602.189-3";"LE";"El HGGB requiere efectuar licitación pública para contar con un convenio suministro para adquirir Circuitos, mascarillas para resucitador, y brazaletes de presión para ser utilizados por Unidades UTI-UCI NEONATAL, URNI Y UTI PEDIATRICA  del HGGB y cubrir programación por 24 meses en Bodega Mat. Mantención.";;;;"CLP";0;0
